{
  "tier": "T3",
  "complexity_rationale": "T3: high-complexity agentic system (LLM loop, tool dispatch, FS sandboxing, diff gen, retry/backoff, stop-condition state machine, config, transcripts) with non-obvious behavior requiring detailed design + ADRs; data-integrity blast-radius flag (mutates user working tree, executes shell) graduates Security and Failure-Modes to standalone stages. Flagship full-pipeline example.",
  "blast_radius_flags": [
    "data-integrity"
  ],
  "current_stage": "implementation-planning",
  "approved_artifacts": [
    {
      "file": "docs/01-requirements.md",
      "version": 3,
      "hash": "51967c89ffd9"
    },
    {
      "file": "docs/02-scope.md",
      "version": 1,
      "hash": "fa5a169fb8b5"
    },
    {
      "file": "docs/03-domain-model.md",
      "version": 1,
      "hash": "ecd334572ec0"
    },
    {
      "file": "docs/04-architecture.md",
      "version": 1,
      "hash": "8b02c1799e99"
    },
    {
      "file": "docs/05-adrs/ADR-001-native-structured-tool-use.md",
      "version": 1,
      "hash": "8fb8a16c0b79"
    },
    {
      "file": "docs/05-adrs/ADR-002-append-only-jsonl-transcript.md",
      "version": 1,
      "hash": "e3048f30424e"
    },
    {
      "file": "docs/05-adrs/ADR-003-single-sequential-agent-loop.md",
      "version": 1,
      "hash": "d78b08056548"
    },
    {
      "file": "docs/05-adrs/ADR-004-di-seams-for-determinism.md",
      "version": 1,
      "hash": "2ebcefa3576c"
    },
    {
      "file": "docs/05-adrs/ADR-005-filesystem-sandbox-model.md",
      "version": 1,
      "hash": "7bffe0a96e2d"
    },
    {
      "file": "docs/05-adrs/ADR-006-command-approval-model.md",
      "version": 1,
      "hash": "a3d7007b07be"
    },
    {
      "file": "docs/05-adrs/ADR-007-tool-errors-as-results.md",
      "version": 1,
      "hash": "f1f5f7ab287b"
    },
    {
      "file": "docs/05-adrs/ADR-008-anthropic-only-single-provider.md",
      "version": 1,
      "hash": "c72b006be9f2"
    },
    {
      "file": "docs/06-technical-design.md",
      "version": 1,
      "hash": "e1efff4cbeee"
    },
    {
      "file": "docs/07-contracts.md",
      "version": 1,
      "hash": "7829c75bd0de"
    },
    {
      "file": "docs/08a-security-threat-model.md",
      "version": 1,
      "hash": "92733536738d"
    },
    {
      "file": "docs/08b-failure-edge-cases.md",
      "version": 1,
      "hash": "ee67e4916f6e"
    },
    {
      "file": "docs/08-test-strategy.md",
      "version": 1,
      "hash": "b8dc1e199415"
    },
    {
      "file": "docs/09-implementation-plan.md",
      "version": 1,
      "hash": "0cb3aa17949c"
    }
  ],
  "summaries_index": "00-project-summary.md",
  "slices": [],
  "implementation_allowed": false,
  "open_questions": [],
  "drift_open_blocking": 0,
  "revise_loop_counts": {}
}
